{
  "$schema": "http://json-schema.org/draft-07/schema#",
  "title": "Client Configuration",
  "type": "object",
  "required": ["client_id", "name", "business"],
  "properties": {
    "client_id": {
      "type": "string",
      "pattern": "^[a-z0-9-]+$",
      "description": "Unique client identifier (lowercase, no spaces)"
    },
    "name": {
      "type": "string",
      "description": "Client display name"
    },
    "enabled": {
      "type": "boolean",
      "default": true,
      "description": "Whether the client is active"
    },
    "created": {
      "type": "string",
      "format": "date-time",
      "description": "Creation timestamp"
    },
    "ports": {
      "type": "object",
      "required": ["dashboard", "bots"],
      "properties": {
        "dashboard": {
          "type": "number",
          "minimum": 3000,
          "maximum": 65535,
          "description": "Port for client dashboard"
        },
        "bots": {
          "type": "array",
          "items": {
            "type": "number",
            "minimum": 3000,
            "maximum": 65535
          },
          "description": "Ports for bot instances"
        }
      }
    },
    "business": {
      "type": "object",
      "required": ["name", "phone"],
      "properties": {
        "name": { "type": "string" },
        "phone": { "type": "string" },
        "address": { "type": "string" },
        "hours": { "type": "string" }
      }
    },
    "admins": {
      "type": "array",
      "items": { "type": "string" },
      "description": "Admin WhatsApp numbers"
    },
    "features": {
      "type": "object",
      "properties": {
        "voice_messages": { "type": "boolean", "default": false },
        "payments": { "type": "boolean", "default": false }       
      }
    }
  }
}
